{
  "$schema": "./catalogue.schema.json",
  "schemaVersion": 1,
  "roots": {
    "content": {
      "description": "User-owned product work. Installed default is `product`; a standalone clone uses the repository root.",
      "installedDefault": "product",
      "standalone": "."
    },
    "toolkit": {
      "description": "Toolkit-managed guidance. Installed under `.product-owner-toolkit`; a standalone clone uses the repository root.",
      "installedDefault": ".product-owner-toolkit/guides",
      "standalone": "."
    }
  },
  "agents": [
    {
      "id": "claude-code",
      "label": "Claude Code",
      "reads": [
        ".claude/skills"
      ],
      "preferredDirectory": ".claude/skills",
      "invocation": "Ask Claude to use the `{skill}` skill"
    },
    {
      "id": "cursor",
      "label": "Cursor",
      "reads": [
        ".cursor/skills",
        ".claude/skills",
        ".agents/skills"
      ],
      "preferredDirectory": ".agents/skills",
      "invocation": "Ask the Cursor agent to use the `{skill}` skill"
    },
    {
      "id": "codex",
      "label": "Codex",
      "reads": [
        ".agents/skills"
      ],
      "preferredDirectory": ".agents/skills",
      "invocation": "Type `${skill}` in Codex"
    }
  ],
  "skills": [
    {
      "name": "bootstrap-context",
      "category": "setup"
    },
    {
      "name": "product-grill",
      "category": "shaping"
    },
    {
      "name": "desktop-research",
      "category": "writing"
    },
    {
      "name": "prd-writer",
      "category": "writing"
    },
    {
      "name": "backlog-writing",
      "category": "writing"
    },
    {
      "name": "meeting-distillation",
      "category": "writing"
    },
    {
      "name": "stakeholder-report",
      "category": "writing"
    },
    {
      "name": "weekly-review",
      "category": "writing"
    },
    {
      "name": "uat-writer",
      "category": "writing"
    },
    {
      "name": "prd-reviewer",
      "category": "review"
    },
    {
      "name": "backlog-review",
      "category": "review"
    },
    {
      "name": "design-system-setup",
      "category": "setup"
    },
    {
      "name": "prototype-builder",
      "category": "writing"
    },
    {
      "name": "prototype-reviewer",
      "category": "review"
    },
    {
      "name": "notion-sync",
      "category": "sync"
    },
    {
      "name": "notion-drift",
      "category": "sync"
    },
    {
      "name": "skill-creator",
      "category": "authoring"
    }
  ],
  "capabilities": [
    {
      "id": "core",
      "label": "Core",
      "description": "Context setup, shaping, research, PRDs, backlogs, reviews, meeting notes, stakeholder reports, weekly reviews, and UAT cases.",
      "required": true,
      "skills": [
        "bootstrap-context",
        "product-grill",
        "desktop-research",
        "prd-writer",
        "backlog-writing",
        "prd-reviewer",
        "backlog-review",
        "meeting-distillation",
        "stakeholder-report",
        "weekly-review",
        "uat-writer"
      ],
      "map": [
        {
          "path": "{content}/context/",
          "purpose": "Company, team, preferences, and product-language context. Read before substantive drafting, reviewing, or presenting work."
        },
        {
          "path": "{content}/requirements/",
          "purpose": "Requirement libraries by type (platform, customer, internal), feature folders, and product decisions in `{content}/requirements/decisions/`."
        },
        {
          "path": "{content}/backlog/",
          "purpose": "Generated Epics and User Stories, grouped by Epic."
        },
        {
          "path": "{content}/testing/uat/test_cases/",
          "purpose": "UAT test-case library, one JSON file per feature area."
        },
        {
          "path": "{content}/personal/",
          "purpose": "Personal notes, to-dos, and reports."
        },
        {
          "path": "{toolkit}/mcp-config/",
          "purpose": "Setup guidance for the MCP servers the skills can use."
        },
        {
          "path": "{toolkit}/conventions/",
          "purpose": "Shared conventions such as markdown front matter."
        }
      ],
      "managed": [
        {
          "source": "mcp-config/README.md",
          "install": "{toolkit}/mcp-config/README.md"
        },
        {
          "source": "mcp-config/firecrawl.md",
          "install": "{toolkit}/mcp-config/firecrawl.md"
        },
        {
          "source": "mcp-config/github.md",
          "install": "{toolkit}/mcp-config/github.md"
        },
        {
          "source": "conventions/front-matter.md",
          "install": "{toolkit}/conventions/front-matter.md"
        }
      ],
      "seed": [
        {
          "source": "context/README.md",
          "install": "{content}/context/README.md"
        },
        {
          "source": "context/company-context.md",
          "install": "{content}/context/company-context.md"
        },
        {
          "source": "context/team-context.md",
          "install": "{content}/context/team-context.md"
        },
        {
          "source": "context/preferences.md",
          "install": "{content}/context/preferences.md"
        },
        {
          "source": "context/product-language.md",
          "install": "{content}/context/product-language.md"
        },
        {
          "source": "requirements/README.md",
          "install": "{content}/requirements/README.md"
        },
        {
          "source": "requirements/decisions/README.md",
          "install": "{content}/requirements/decisions/README.md"
        },
        {
          "source": "requirements/customer-functional-requirements/.gitkeep",
          "install": "{content}/requirements/customer-functional-requirements/.gitkeep"
        },
        {
          "source": "requirements/internal-functional-requirements/.gitkeep",
          "install": "{content}/requirements/internal-functional-requirements/.gitkeep"
        },
        {
          "source": "requirements/platform-requirements/.gitkeep",
          "install": "{content}/requirements/platform-requirements/.gitkeep"
        },
        {
          "source": "testing/uat/test_cases/README.md",
          "install": "{content}/testing/uat/test_cases/README.md"
        },
        {
          "source": "personal/README.md",
          "install": "{content}/personal/README.md"
        },
        {
          "source": "personal/to-dos/done/.gitkeep",
          "install": "{content}/personal/to-dos/done/.gitkeep"
        },
        {
          "source": "personal/to-dos/not-done/.gitkeep",
          "install": "{content}/personal/to-dos/not-done/.gitkeep"
        }
      ]
    },
    {
      "id": "prototyping",
      "label": "Prototyping",
      "description": "Design-system profiles, interactive prototypes from PRDs, the local prototype playground, and amendment review.",
      "required": false,
      "skills": [
        "design-system-setup",
        "prototype-builder",
        "prototype-reviewer"
      ],
      "map": [
        {
          "path": "{content}/design-system/",
          "purpose": "Design sources and immutable design profiles; `{content}/design-system/profiles/ACTIVE` pins the current profile."
        },
        {
          "path": "prototype-playground/",
          "purpose": "Local app that validates, previews, and packages prototypes. Run `npm run validate` there after generating prototypes."
        }
      ],
      "managed": [
        {
          "source": "mcp-config/pen-dev.md",
          "install": "{toolkit}/mcp-config/pen-dev.md"
        },
        {
          "source": "mcp-config/figma.md",
          "install": "{toolkit}/mcp-config/figma.md"
        }
      ],
      "runtime": {
        "source": "prototype-playground",
        "install": "prototype-playground",
        "include": [
          ".gitignore",
          "index.html",
          "package.json",
          "package-lock.json",
          "tsconfig.json",
          "vite.config.ts",
          "schemas/*.json",
          "scripts/build-handoff.ts",
          "scripts/validate.ts",
          "src/**/*.{ts,tsx,css}"
        ],
        "exclude": [
          "src/**/*.test.ts",
          "src/testing/**"
        ],
        "unmanaged": [
          "node_modules/**",
          "dist/**",
          "test-results/**",
          ".e2e-tmp/**"
        ]
      },
      "seed": [
        {
          "source": "design-system/README.md",
          "install": "{content}/design-system/README.md"
        },
        {
          "source": "design-system/example-design-system.pen",
          "install": "{content}/design-system/example-design-system.pen"
        },
        {
          "source": "design-system/profiles/ACTIVE",
          "install": "{content}/design-system/profiles/ACTIVE"
        },
        {
          "source": "design-system/profiles/v002/profile.json",
          "install": "{content}/design-system/profiles/v002/profile.json"
        },
        {
          "source": "design-system/profiles/v002/tokens.css",
          "install": "{content}/design-system/profiles/v002/tokens.css"
        },
        {
          "source": "design-system/profiles/v002/components.json",
          "install": "{content}/design-system/profiles/v002/components.json"
        },
        {
          "source": "design-system/profiles/v002/assets.json",
          "install": "{content}/design-system/profiles/v002/assets.json"
        }
      ]
    },
    {
      "id": "notion",
      "label": "Notion",
      "description": "Sync backlog artefacts to Notion databases and check synced pages for drift.",
      "required": false,
      "skills": [
        "notion-sync",
        "notion-drift"
      ],
      "map": [],
      "managed": [
        {
          "source": "mcp-config/notion.md",
          "install": "{toolkit}/mcp-config/notion.md"
        }
      ],
      "seed": []
    },
    {